{"schema_version": "stage1-validate-2", "tool_version": "stage0-gate/0.2.0 (shapely/pyproj/PyYAML/pydantic)", "python": "3.13.14", "generated_at": "2026-10-27T03:49:35.824607+00:00", "bundle": "C:\\Users\\TempAdmin\\Documents\\Codex\\2026-10-26\\mu\\outputs\\GeoAcceptance\\work\\local-app\\runs\\4f8df9fa7a4e47be83e1125b1754edf0", "mode": "validate", "mode_note": "正式检查入口：不需要 expected 真值，结论只来自内核唯一判定路径。", "expected_used": false, "inputs": {"delivery_spec.md": {"sha256": "93a778c0316d46e0cc9f2c53dee435d9ddcb826bacbfce0d4550ab8f9134cb22", "bytes": 1133}, "dictionary.csv": {"sha256": "24ea76d4f1cc7bcb6de684d6b8b5fe48354c46e2124600cfb4877c50638cd7ee", "bytes": 365}, "poi.csv": {"sha256": "ae205f0ee226992326296d3fcaf5b8990530fc8d9668119452e89f291dddd8eb", "bytes": 1174}, "area.geojson": {"sha256": "dcd51cef97c0dbc5c334352895849bdaa99547b9cef15ca0e48396e279779976", "bytes": 288}, "crs.json": {"sha256": "9c8f3c1a9bc3c717bac6b21d807399d62872ccb1efb55fddef4af39eb2f06ebc", "bytes": 152}, "requirements.yaml": {"sha256": "6d4fd44d8f173be74d0baf28c7d38d66ce3de80b1d1a87b391052a7fe987d1c8", "bytes": 4841}, "approved-rules.yaml": {"sha256": "a3b9df250424a769d52113e3af60d74bec14a0ea9d451f505df68b1ac74c0b28", "bytes": 8652}}, "executed": true, "exec_error": null, "clauses_pending": [], "config_rejections": [], "preflight_problems": [], "aggregate_verdict": "PASS", "aggregate_reason": "全部必检条款均有完整有效的 PASS 证据", "clause_coverage": [{"requirement_id": "A1", "required_for_release": true, "support_status": "SUPPORTED", "mapped_rule_ids": ["R01"], "coverage_state": "COVERED", "verdict": "PASS", "execution_status": "COMPLETED", "reason_code": "OK"}, {"requirement_id": "A2", "required_for_release": true, "support_status": "SUPPORTED", "mapped_rule_ids": ["R02"], "coverage_state": "COVERED", "verdict": "PASS", "execution_status": "COMPLETED", "reason_code": "OK"}, {"requirement_id": "A3", "required_for_release": true, "support_status": "SUPPORTED", "mapped_rule_ids": ["R03"], "coverage_state": "COVERED", "verdict": "PASS", "execution_status": "COMPLETED", "reason_code": "OK"}, {"requirement_id": "A4", "required_for_release": true, "support_status": "SUPPORTED", "mapped_rule_ids": ["R04"], "coverage_state": "COVERED", "verdict": "PASS", "execution_status": "COMPLETED", "reason_code": "OK"}, {"requirement_id": "A5", "required_for_release": true, "support_status": "SUPPORTED", "mapped_rule_ids": ["R05"], "coverage_state": "COVERED", "verdict": "PASS", "execution_status": "COMPLETED", "reason_code": "OK"}, {"requirement_id": "B1", "required_for_release": true, "support_status": "SUPPORTED", "mapped_rule_ids": ["R06"], "coverage_state": "COVERED", "verdict": "PASS", "execution_status": "COMPLETED", "reason_code": "OK"}, {"requirement_id": "B2", "required_for_release": true, "support_status": "SUPPORTED", "mapped_rule_ids": ["R07"], "coverage_state": "COVERED", "verdict": "PASS", "execution_status": "COMPLETED", "reason_code": "OK"}, {"requirement_id": "B3", "required_for_release": true, "support_status": "SUPPORTED", "mapped_rule_ids": ["R08"], "coverage_state": "COVERED", "verdict": "PASS", "execution_status": "COMPLETED", "reason_code": "OK"}, {"requirement_id": "C1", "required_for_release": true, "support_status": "SUPPORTED", "mapped_rule_ids": ["R09"], "coverage_state": "COVERED", "verdict": "PASS", "execution_status": "COMPLETED", "reason_code": "OK"}], "check_results": [{"rule_id": "R01", "requirement_ids": ["A1"], "verdict": "PASS", "execution_status": "COMPLETED", "reason_code": "OK", "summary_counts": {"records_total": 15, "records_evaluated": 15, "records_failed": 0, "records_indeterminate": 0, "records_skipped_upstream": 0, "records_uninterpretable": 0, "records_blocked": 0, "findings": 0}, "required_for_release": true}, {"rule_id": "R02", "requirement_ids": ["A2"], "verdict": "PASS", "execution_status": "COMPLETED", "reason_code": "OK", "summary_counts": {"records_total": 15, "records_evaluated": 15, "records_failed": 0, "records_indeterminate": 0, "records_skipped_upstream": 0, "records_uninterpretable": 0, "records_blocked": 0, "findings": 0}, "required_for_release": true}, {"rule_id": "R03", "requirement_ids": ["A3"], "verdict": "PASS", "execution_status": "COMPLETED", "reason_code": "OK", "summary_counts": {"records_total": 15, "records_evaluated": 15, "records_failed": 0, "records_indeterminate": 0, "records_skipped_upstream": 0, "records_uninterpretable": 0, "records_blocked": 0, "findings": 0}, "required_for_release": true}, {"rule_id": "R04", "requirement_ids": ["A4"], "verdict": "PASS", "execution_status": "COMPLETED", "reason_code": "OK", "summary_counts": {"records_total": 15, "records_evaluated": 15, "records_failed": 0, "records_indeterminate": 0, "records_skipped_upstream": 0, "records_uninterpretable": 0, "records_blocked": 0, "findings": 0}, "required_for_release": true}, {"rule_id": "R05", "requirement_ids": ["A5"], "verdict": "PASS", "execution_status": "COMPLETED", "reason_code": "OK", "summary_counts": {"records_total": 15, "records_evaluated": 15, "records_failed": 0, "records_indeterminate": 0, "records_skipped_upstream": 0, "records_uninterpretable": 0, "records_blocked": 0, "findings": 0}, "required_for_release": true}, {"rule_id": "R07", "requirement_ids": ["B2"], "verdict": "PASS", "execution_status": "COMPLETED", "reason_code": "OK", "summary_counts": {"records_total": 15, "records_evaluated": 15, "records_failed": 0, "records_indeterminate": 0, "records_skipped_upstream": 0, "records_uninterpretable": 0, "records_blocked": 0, "findings": 0}, "required_for_release": true}, {"rule_id": "R09", "requirement_ids": ["C1"], "verdict": "PASS", "execution_status": "COMPLETED", "reason_code": "OK", "summary_counts": {"records_total": 15, "records_evaluated": 15, "records_failed": 0, "records_indeterminate": 0, "records_skipped_upstream": 0, "records_uninterpretable": 0, "records_blocked": 0, "findings": 0}, "required_for_release": true}, {"rule_id": "R06", "requirement_ids": ["B1"], "verdict": "PASS", "execution_status": "COMPLETED", "reason_code": "OK", "summary_counts": {"records_total": 15, "records_evaluated": 15, "records_failed": 0, "records_indeterminate": 0, "records_skipped_upstream": 0, "records_uninterpretable": 0, "records_blocked": 0, "findings": 0}, "required_for_release": true}, {"rule_id": "R08", "requirement_ids": ["B3"], "verdict": "PASS", "execution_status": "COMPLETED", "reason_code": "OK", "summary_counts": {"records_total": 15, "records_evaluated": 15, "records_failed": 0, "records_indeterminate": 0, "records_skipped_upstream": 0, "records_uninterpretable": 0, "records_blocked": 0, "findings": 0}, "required_for_release": true}, {"rule_id": "R10", "requirement_ids": ["C2"], "verdict": "INDETERMINATE", "execution_status": "COMPLETED", "reason_code": "DUPLICATE_CANDIDATE", "summary_counts": {"records_total": 15, "records_evaluated": 15, "records_failed": 0, "records_indeterminate": 2, "records_skipped_upstream": 0, "records_uninterpretable": 0, "records_blocked": 0, "findings": 1}, "required_for_release": false}], "findings": [{"finding_id": "F0001", "stable_key": "R10|DUPLICATE_CANDIDATE|12|longitude/latitude", "record_locator": {"file": "poi.csv", "line": 12, "record_id": "SD-0011"}, "record_id": "SD-0011", "rule_id": "R10", "field": "longitude/latitude", "observed_value": "116.314,39.9185 与 116.3142,39.9186", "expected_constraint": "相距不超过 30 米且同名，须人工确认是否重复", "reason_code": "DUPLICATE_CANDIDATE", "evidence": {"distance_m": 20.39, "peer_line": 13, "peer_record_id": "SD-0012"}, "review_state": "OPEN"}], "findings_by_class": {"CANDIDATE": 1}, "counts": {"records": 15, "clauses_required": 9, "clauses_covered": 9, "rules": 10, "findings": 1}}